1,中鼎博华（北京）投资有限公司,"登录验证码：98534168，验证有效期5分钟，请您尽快处理…【兑兑碰】",13000001111,1
0,中鼎博华（北京）投资有限公司,您好，您在兑兑碰商家吉林市永鹏农副产品开发有限公司消费，获赠10兑币，已成功到账，祝您消费愉快。兑商城网址：http://m.duiduipeng.net 【兑兑碰】,13000011111,2
0,中鼎博华（北京）投资有限公司,"系统已经成功取消您的订单：ddp201510140427219855，支付的兑币7082已经成功返还。【兑兑碰】",13000021111,3
0,中鼎博华（北京）投资有限公司,您好，订单ddp201510140436392316已兑换成功，依据快递正常6-8天到货。如有疑问，请致电4008889791【兑兑碰】,13000031111,4
0,中鼎博华（北京）投资有限公司,兑时代、兑生活、兑科技，恭喜您加入兑家族，特奖励您10兑币，祝您兑愉快！网址：http://api.duiduipeng.net/reg/regist.html【兑兑碰】,13000041111,5
0,中鼎博华（北京）投资有限公司,"尊敬的会员，您兑换礼品的密码是:112610，剩余时间10分钟，请您尽快下单，祝您兑换愉快，若非本人操作，请忽略该短信。【兑兑碰】",13000051111,6
